{"project":"windrunner","seed":2147483648,"mode":"evaluate","summary":{"protocol":"paired held-out cave seeds; deterministic policy mean; random uniform actions; fixed avalanche-hashed seed schedule","heldOutSeedRange":[2147483648,4294967295],"heldOutEpisodes":64,"trainingSeedRange":[1,1073741823],"baselines":{"trained":{"episodes":64,"meanReturn":112.325460036,"stdReturn":0.212508204075,"meanDistance":64.1769221713,"meanSteps":146.09375,"successRate":1,"collisionRate":0,"timeoutRate":0,"successes":64,"collisions":0,"timeouts":0},"random":{"episodes":64,"meanReturn":-26.4415274799,"stdReturn":2.5250915933,"meanDistance":1.53367011919,"meanSteps":31.578125,"successRate":0,"collisionRate":1,"timeoutRate":0,"successes":0,"collisions":64,"timeouts":0},"zero":{"episodes":64,"meanReturn":-26.4506754648,"stdReturn":1.53480029155,"meanDistance":1.24814058435,"meanSteps":32.15625,"successRate":0,"collisionRate":1,"timeoutRate":0,"successes":0,"collisions":64,"timeouts":0}}},"episodes":[{"seed":2506658466,"trained":{"return":112.768359879,"distance":64.342482467,"steps":148,"terminal":"goal"},"random":{"return":-26.3225487958,"distance":1.76163918235,"steps":29,"terminal":"collision"},"zero":{"return":-27.3662859063,"distance":0.97514072726,"steps":24,"terminal":"collision"}},{"seed":3970628429,"trained":{"return":112.369258404,"distance":64.099718454,"steps":148,"terminal":"goal"},"random":{"return":-27.5639253278,"distance":1.31488019668,"steps":18,"terminal":"collision"},"zero":{"return":-28.1590416605,"distance":0.644048469664,"steps":18,"terminal":"collision"}},{"seed":3967066815,"trained":{"return":112.379060361,"distance":64.1558310687,"steps":148,"terminal":"goal"},"random":{"return":-28.6203496423,"distance":0.482288446346,"steps":18,"terminal":"collision"},"zero":{"return":-28.3340118017,"distance":0.336987059472,"steps":22,"terminal":"collision"}},{"seed":2934300186,"trained":{"return":111.952123462,"distance":64.0625313003,"steps":144,"terminal":"goal"},"random":{"return":-26.0448055459,"distance":2.35092095967,"steps":23,"terminal":"collision"},"zero":{"return":-27.0219093417,"distance":1.53849553527,"steps":20,"terminal":"collision"}},{"seed":3139670821,"trained":{"return":112.265499602,"distance":64.2120957129,"steps":144,"terminal":"goal"},"random":{"return":-24.3947964957,"distance":2.99849059005,"steps":35,"terminal":"collision"},"zero":{"return":-24.5285477819,"distance":2.44966763756,"steps":40,"terminal":"collision"}},{"seed":2477457581,"trained":{"return":112.319872954,"distance":64.0369745752,"steps":147,"terminal":"goal"},"random":{"return":-28.1791982061,"distance":0.48035518722,"steps":25,"terminal":"collision"},"zero":{"return":-26.9796121978,"distance":1.27408291901,"steps":25,"terminal":"collision"}},{"seed":2562484611,"trained":{"return":112.474112433,"distance":64.3580417356,"steps":145,"terminal":"goal"},"random":{"return":-23.8078306051,"distance":3.83157864346,"steps":30,"terminal":"collision"},"zero":{"return":-25.9347045191,"distance":1.95635457347,"steps":28,"terminal":"collision"}},{"seed":3504927282,"trained":{"return":111.872548778,"distance":64.0932623417,"steps":143,"terminal":"goal"},"random":{"return":-25.6617571384,"distance":2.59783966473,"steps":24,"terminal":"collision"},"zero":{"return":-26.0044857121,"distance":2.05282805747,"steps":25,"terminal":"collision"}},{"seed":3915631463,"trained":{"return":112.217997378,"distance":64.1996401525,"steps":146,"terminal":"goal"},"random":{"return":-25.7061843281,"distance":2.39077090379,"steps":26,"terminal":"collision"},"zero":{"return":-27.5632314118,"distance":0.998097958276,"steps":21,"terminal":"collision"}},{"seed":3423303926,"trained":{"return":112.079229897,"distance":64.158040224,"steps":145,"terminal":"goal"},"random":{"return":-28.4379124392,"distance":0.583196668865,"steps":18,"terminal":"collision"},"zero":{"return":-27.7025159515,"distance":0.988024441024,"steps":19,"terminal":"collision"}},{"seed":2674694765,"trained":{"return":112.414863587,"distance":64.0762700118,"steps":149,"terminal":"goal"},"random":{"return":-28.3687940423,"distance":0.26017320929,"steps":26,"terminal":"collision"},"zero":{"return":-27.8988862133,"distance":0.506635435039,"steps":24,"terminal":"collision"}},{"seed":3845847305,"trained":{"return":112.518550078,"distance":64.264995151,"steps":149,"terminal":"goal"},"random":{"return":-29.3204825767,"distance":-1.06921404739,"steps":28,"terminal":"collision"},"zero":{"return":-28.4494494606,"distance":-1.02468508662,"steps":41,"terminal":"collision"}},{"seed":3946181378,"trained":{"return":112.293064914,"distance":64.1793877324,"steps":146,"terminal":"goal"},"random":{"return":-24.1143759361,"distance":2.6394898366,"steps":49,"terminal":"collision"},"zero":{"return":-25.7454125952,"distance":1.7409119879,"steps":33,"terminal":"collision"}},{"seed":3029175911,"trained":{"return":112.206851148,"distance":64.0938537512,"steps":145,"terminal":"goal"},"random":{"return":-26.1864681585,"distance":1.91995667037,"steps":30,"terminal":"collision"},"zero":{"return":-26.4904292219,"distance":1.7827451564,"steps":24,"terminal":"collision"}},{"seed":3010089274,"trained":{"return":112.247295242,"distance":64.0151949237,"steps":148,"terminal":"goal"},"random":{"return":-27.9512074198,"distance":0.549227677503,"steps":28,"terminal":"collision"},"zero":{"return":-28.4748604561,"distance":0.137040912677,"steps":23,"terminal":"collision"}},{"seed":2312333810,"trained":{"return":112.09682892,"distance":64.053485589,"steps":144,"terminal":"goal"},"random":{"return":-22.9398020192,"distance":4.10673664565,"steps":38,"terminal":"collision"},"zero":{"return":-25.4184393464,"distance":2.41334939278,"steps":27,"terminal":"collision"}},{"seed":2237130927,"trained":{"return":112.263228257,"distance":64.0108719169,"steps":147,"terminal":"goal"},"random":{"return":-27.6233112582,"distance":0.785522637454,"steps":27,"terminal":"collision"},"zero":{"return":-26.9553317824,"distance":1.21564452326,"steps":25,"terminal":"collision"}},{"seed":4224283373,"trained":{"return":112.511727105,"distance":64.342120075,"steps":145,"terminal":"goal"},"random":{"return":-26.6259517476,"distance":1.67198337636,"steps":27,"terminal":"collision"},"zero":{"return":-24.5279755212,"distance":2.63266328134,"steps":36,"terminal":"collision"}},{"seed":3116432389,"trained":{"return":111.990790271,"distance":64.0065278118,"steps":144,"terminal":"goal"},"random":{"return":-27.61031797,"distance":1.20293865624,"steps":20,"terminal":"collision"},"zero":{"return":-26.2639911196,"distance":1.97119293848,"steps":23,"terminal":"collision"}},{"seed":2372664038,"trained":{"return":112.218594252,"distance":64.1889551003,"steps":144,"terminal":"goal"},"random":{"return":-25.9535565448,"distance":2.01787794142,"steps":31,"terminal":"collision"},"zero":{"return":-25.5601939524,"distance":2.36065582176,"steps":27,"terminal":"collision"}},{"seed":3140627227,"trained":{"return":112.33175988,"distance":64.113585285,"steps":148,"terminal":"goal"},"random":{"return":-22.1948007607,"distance":3.60544795354,"steps":70,"terminal":"collision"},"zero":{"return":-27.0302162293,"distance":-0.852007820052,"steps":56,"terminal":"collision"}},{"seed":4090135538,"trained":{"return":112.04887911,"distance":64.0287919185,"steps":144,"terminal":"goal"},"random":{"return":-27.0514749407,"distance":0.956557049777,"steps":33,"terminal":"collision"},"zero":{"return":-25.5278276528,"distance":1.8298757109,"steps":36,"terminal":"collision"}},{"seed":3409493758,"trained":{"return":112.495322734,"distance":64.2997722138,"steps":146,"terminal":"goal"},"random":{"return":-15.7151350354,"distance":8.6887654542,"steps":65,"terminal":"collision"},"zero":{"return":-26.0710461103,"distance":1.06114866597,"steps":45,"terminal":"collision"}},{"seed":2938259081,"trained":{"return":112.149468701,"distance":64.1001852668,"steps":144,"terminal":"goal"},"random":{"return":-23.0740214309,"distance":4.19829579435,"steps":35,"terminal":"collision"},"zero":{"return":-22.8610412124,"distance":2.9053675009,"steps":53,"terminal":"collision"}},{"seed":3088185315,"trained":{"return":112.33818169,"distance":64.0880235233,"steps":148,"terminal":"goal"},"random":{"return":-29.4640184066,"distance":-1.12723242778,"steps":27,"terminal":"collision"},"zero":{"return":-27.9697610954,"distance":-1.02504679228,"steps":48,"terminal":"collision"}},{"seed":3344442130,"trained":{"return":112.06311395,"distance":64.0569736553,"steps":144,"terminal":"goal"},"random":{"return":-26.2504032139,"distance":2.11891201235,"steps":25,"terminal":"collision"},"zero":{"return":-26.3605244194,"distance":1.93260144088,"steps":23,"terminal":"collision"}},{"seed":2752997700,"trained":{"return":112.49386535,"distance":64.150593144,"steps":149,"terminal":"goal"},"random":{"return":-28.5089813969,"distance":0.241997005539,"steps":24,"terminal":"collision"},"zero":{"return":-28.2440387011,"distance":0.231161748756,"steps":25,"terminal":"collision"}},{"seed":2510707510,"trained":{"return":112.29923049,"distance":64.1004281459,"steps":146,"terminal":"goal"},"random":{"return":-25.8380353274,"distance":2.27052336137,"steps":28,"terminal":"collision"},"zero":{"return":-27.0168331769,"distance":1.40921614375,"steps":22,"terminal":"collision"}},{"seed":4134832705,"trained":{"return":112.306021422,"distance":64.0848953341,"steps":146,"terminal":"goal"},"random":{"return":-23.8287070004,"distance":2.40087023565,"steps":62,"terminal":"collision"},"zero":{"return":-26.1755263749,"distance":1.20372584994,"steps":38,"terminal":"collision"}},{"seed":3160624756,"trained":{"return":112.300909094,"distance":64.0164802143,"steps":148,"terminal":"goal"},"random":{"return":-29.0225523621,"distance":-1.09215077888,"steps":34,"terminal":"collision"},"zero":{"return":-27.4572711279,"distance":-1.00226011264,"steps":53,"terminal":"collision"}},{"seed":3368232257,"trained":{"return":112.451169477,"distance":64.3309462609,"steps":147,"terminal":"goal"},"random":{"return":-2